{
  "schema_version": "m6a-g4-resource-runtime-preflight-candidate-v1",
  "task_id": "M6A-PUBLIC-001",
  "status": "G4_RESOURCE_AND_RUNTIME_PREFLIGHT_CANDIDATE_AWAITING_COORDINATOR_REVIEW",
  "integrity_policy": "NON_HASH_AUDIT",
  "dependency": {
    "g4_protocol_status": "G4_PROTOCOL_AMENDMENT_CANDIDATE_AWAITING_COORDINATOR_REVIEW",
    "g4_protocol_review": "PENDING",
    "g4_protocol_reviewed_on": null,
    "g4_protocol_config": "configs/m6a_g4_protocol_candidate.json",
    "g4_protocol_report": "reports/g4_protocol_amendment_candidate_20260813_v2.json",
    "prior_g4_protocol_status": "G4_PROTOCOL_COORDINATOR_ACCEPTED",
    "prior_g4_protocol_report": "reports/g4_protocol_candidate_20260813_v3.json",
    "amendment_scope": "WAV2VEC2_PREPROCESSING_INPUT_CONTRACT_ONLY",
    "g4_scientific_result_claimed": false
  },
  "storage": {
    "project_root": "/home/fanyu/auditory_simulation_m6a",
    "categories": {
      "data": ["/home/fanyu/auditory_simulation_m6a/data"],
      "cache": ["/home/fanyu/auditory_simulation_m6a/cache"],
      "outputs": ["/home/fanyu/auditory_simulation_m6a/outputs"],
      "log": [
        "/home/fanyu/auditory_simulation_m6a/log",
        "/home/fanyu/auditory_simulation_m6a/logs"
      ],
      "code": ["/home/fanyu/auditory_simulation_m6a/code_snapshot"]
    },
    "measurement": "REGULAR_FILE_BYTES_WITHOUT_FOLLOWING_SYMLINKS",
    "minimum_actual_free_bytes": 500000000000,
    "estimated_new_bytes_upper_bound": 20000000000,
    "data_cache_plus_estimated_new_strictly_below_bytes": 500000000000
  },
  "model": {
    "model_id": "facebook/wav2vec2-base",
    "revision_label": "main",
    "cache_path": "/home/fanyu/auditory_simulation_m6a/cache/huggingface/facebook_wav2vec2_base_main_20260813",
    "cache_state": "SEMANTICALLY_VALIDATED_REMOTE_ONLY",
    "download_allowed": false,
    "local_files_only": true,
    "trust_remote_code": false,
    "repository_custom_code_executed": false,
    "weights_only_required": true,
    "tensor_only_required": true,
    "model_eval_required": true,
    "inference_mode_required": true,
    "parameter_requires_grad_count_expected": 0,
    "batch_size": 1,
    "sample_rate_hz": 16000,
    "hidden_size": 768,
    "input_preprocessing": {
      "preprocessor_config_filename": "preprocessor_config.json",
      "preprocessor_config_source_endpoint": "https://hf-mirror.com",
      "preprocessor_source_probe": "reports/wav2vec2_model_mirror_probe_20260813.json",
      "preprocessor_config_bytes": 159,
      "cache_state": "SEMANTICALLY_VALIDATED_REMOTE_ONLY",
      "feature_size": 1,
      "sampling_rate_hz": 16000,
      "do_normalize": true,
      "return_attention_mask": false,
      "padding_value": 0.0,
      "padding_side": "right",
      "input_dtype": "float32",
      "passage_scope": "EACH_PASSAGE_INDEPENDENT_NO_CROSS_PASSAGE_STATISTICS",
      "normalization_formula": "(x - mean_float32(x)) / sqrt(population_variance_float32_ddof0(x) + 1e-7)",
      "normalization_epsilon": 1e-7,
      "constant_input_action": "FAIL_BEFORE_FEATURE_EXTRACTOR",
      "nonfinite_input_action": "FAIL_BEFORE_FEATURE_EXTRACTOR",
      "no_padding_policy": "SINGLE_PASSAGE_NO_PADDING",
      "attention_mask_argument": "OMITTED",
      "validation_test_scope": "SAME_FIXED_PARAMETER_FREE_PASSAGE_WISE_RULE",
      "train_fitted_statistics_used": false,
      "cross_passage_statistics_allowed": false
    },
    "layer_keys": [
      "projected",
      "transformer_01",
      "transformer_02",
      "transformer_03",
      "transformer_04",
      "transformer_05",
      "transformer_06",
      "transformer_07",
      "transformer_08",
      "transformer_09",
      "transformer_10",
      "transformer_11",
      "transformer_12"
    ],
    "attention_scope": "GLOBAL_WITHIN_ONE_SYNTHETIC_PASSAGE"
  },
  "longest_passage": {
    "manifest_path": "reports/ds004703_primary_split.csv",
    "recording_id": "sub-SD012_ses-02_task-PassiveListen",
    "selection_rule": "MAX_AUDIO_DURATION_SECONDS_THEN_SAMPLE_ID_LEXICOGRAPHIC",
    "expected_passage_count": 40,
    "sample_id": "sub-SD012_ses-02_task-PassiveListen__seg-028",
    "stimulus_id": "s3201a-ex01",
    "split": "validation",
    "audio_file_metadata_only": "stimuli/excerpts/Block 3/s3201a-ex01_normed.wav",
    "audio_duration_seconds": 77.08981859410432,
    "sample_count_formula": "CEIL_AUDIO_DURATION_SECONDS_TIMES_16000",
    "expected_synthetic_sample_count": 1233438,
    "expected_frame_count": 3854,
    "real_audio_read_allowed": false
  },
  "synthetic_input": {
    "source": "DETERMINISTIC_IN_MEMORY_FINITE_MONO_NO_FILE_PATH",
    "formula": "FLOAT32_0P1_SIN_220HZ_PLUS_0P05_SIN_440HZ_AT_N_OVER_16000",
    "finite_required": true,
    "channels": 1,
    "input_path": null,
    "neighbor_input_allowed": false
  },
  "runtime_canary": {
    "cuda_required": true,
    "warmup_seconds": 1.0,
    "warmup_sample_count": 16000,
    "longest_forward_count": 1,
    "output_hidden_states": true,
    "model_input_padding_samples": 0,
    "feature_extractor_equivalence_absolute_tolerance": 1e-7,
    "feature_extractor_equivalence_relative_tolerance": 1e-7,
    "attention_mask_argument": "OMITTED",
    "oom_action": "FAIL_NO_MODEL_CHANGE_NO_CHUNK_APPROXIMATION",
    "nonfinite_action": "FAIL",
    "shape_or_layer_drift_action": "FAIL",
    "chunked_or_windowed_model_approximation_allowed": false,
    "measurements": [
      "MODEL_LOAD_WALL_SECONDS",
      "WARMUP_WALL_SECONDS",
      "LONGEST_FORWARD_WALL_SECONDS",
      "CUDA_PEAK_ALLOCATED_BYTES",
      "CUDA_PEAK_RESERVED_BYTES",
      "THIRTEEN_LAYER_SHAPES_AND_FINITE",
      "PREPROCESSOR_CONFIG_AND_FEATURE_EXTRACTOR_EQUIVALENCE"
    ]
  },
  "execution_estimate": {
    "passage_count": 40,
    "model_load_safety_multiplier": 2.0,
    "model_load_minimum_upper_bound_seconds": 60.0,
    "forward_safety_multiplier": 2.0,
    "forward_minimum_upper_bound_seconds": 60.0,
    "checkpoint_and_process_overhead_upper_bound_seconds": 30.0,
    "single_invocation_formula": "MAX_60_AND_2X_MODEL_LOAD_PLUS_MAX_60_AND_2X_LONGEST_FORWARD_PLUS_30",
    "total_formula": "40_TIMES_SINGLE_INVOCATION_UPPER_BOUND",
    "single_invocation_gpu_hours_strictly_below": 2.0,
    "total_gpu_hours_maximum": 4.0,
    "continuous_formal_gpu_hours_report_threshold": 24.0,
    "duration_linear_scaling_assumed": false
  },
  "checkpoint_design": {
    "execution_unit": "ONE_PASSAGE_PER_INVOCATION",
    "write_order": "WRITE_TENSORS_AND_LIGHTWEIGHT_METADATA_TO_DEDICATED_PARTIAL_THEN_VALIDATE_BYTES_SHAPE_DTYPE_FINITE_THEN_ATOMIC_RENAME",
    "successful_passage_checkpoint_required": true,
    "resume_skips_only_validated_final_checkpoint": true,
    "partial_preserved_on_failure": true,
    "delete_on_failure_allowed": false,
    "checkpoint_before_two_hour_limit": true
  },
  "execution": {
    "preflight_only": true,
    "g4_execution_authorized": false,
    "new_real_edf_read": false,
    "new_real_audio_read": false,
    "real_feature_extraction_run": false,
    "ridge_run": false,
    "null_run": false,
    "metric_run": false,
    "scientific_result_claimed": false,
    "exchange_candidate_created": false,
    "allowed_output_status": "G4_RESOURCE_AND_RUNTIME_PREFLIGHT_CANDIDATE_AWAITING_COORDINATOR_REVIEW"
  }
}
